<!--
  Copyright © 2009      CNRS
  Copyright © 2009-2013 Inria.  All rights reserved.
  Copyright © 2009-2011 Université Bordeaux 1.
  See COPYING in top-level directory.
 -->

<!ELEMENT topology (object)+>
<!ELEMENT root (object)+>

<!ELEMENT object (page_type*,info*,distances*,userdata*,object*)>
<!ATTLIST object type (System | Machine | Misc | Group | NUMANode | Socket| Cache | Core | PU | Bridge | PCIDev | OSDev) #REQUIRED>
<!ATTLIST object os_level CDATA "-1" >
<!ATTLIST object os_index CDATA "-1" >
<!ATTLIST object name CDATA "" >
<!ATTLIST object local_memory CDATA "0" >
<!ATTLIST object cache_size CDATA "0" >
<!ATTLIST object cache_linesize CDATA "0" >
<!ATTLIST object cache_associativity CDATA "0" >
<!ATTLIST object cache_type CDATA "0" >
<!ATTLIST object huge_page_size_kB CDATA "0" >
<!ATTLIST object huge_page_free CDATA "0" >
<!ATTLIST object depth CDATA "-1" >
<!ATTLIST object cpuset CDATA "0" >
<!ATTLIST object complete_cpuset CDATA "" >
<!ATTLIST object online_cpuset CDATA "" >
<!ATTLIST object allowed_cpuset CDATA "" >
<!ATTLIST object nodeset CDATA "" >
<!ATTLIST object complete_nodeset CDATA "" >
<!ATTLIST object allowed_nodeset CDATA "" >
<!ATTLIST object bridge_type CDATA "" >
<!ATTLIST object bridge_pci CDATA "" >
<!ATTLIST object pci_busid CDATA "" >
<!ATTLIST object pci_type CDATA "" >
<!ATTLIST object pci_link_speed CDATA "0." >
<!ATTLIST object osdev_type CDATA "" >

<!ELEMENT page_type EMPTY>
<!ATTLIST page_type size CDATA #REQUIRED>
<!ATTLIST page_type count CDATA #REQUIRED>

<!ELEMENT info EMPTY>
<!ATTLIST info name CDATA #REQUIRED>
<!ATTLIST info value CDATA #REQUIRED>

<!ELEMENT distances (latency*)>
<!ATTLIST distances nbobjs CDATA #REQUIRED>
<!ATTLIST distances relative_depth CDATA #REQUIRED>
<!ATTLIST distances latency_base CDATA #REQUIRED>

<!ELEMENT latency EMPTY>
<!ATTLIST latency value CDATA #REQUIRED>

<!ELEMENT userdata (#PCDATA)>
<!ATTLIST userdata name CDATA "" >
<!ATTLIST userdata length CDATA "0" >
<!ATTLIST userdata encoding CDATA "" >


<!ELEMENT topologydiff (diff)*>
<!ATTLIST topologydiff refname CDATA "">

<!ELEMENT diff EMPTY>
<!ATTLIST diff type CDATA #REQUIRED>
<!ATTLIST diff obj_depth CDATA "-1" >
<!ATTLIST diff obj_index CDATA "-1" >
<!ATTLIST diff obj_attr_type CDATA "-1" >
<!ATTLIST diff obj_attr_index CDATA "-1" >
<!ATTLIST diff obj_attr_name CDATA "" >
<!ATTLIST diff obj_attr_newvalue CDATA "" >
<!ATTLIST diff obj_attr_oldvalue CDATA "" >
