<?xml version="1.0" encoding="UTF-8"?>
<!DOCTYPE topology SYSTEM "hwloc.dtd">
<topology>
  <object type="Machine" os_index="0" cpuset="0x000f000f" complete_cpuset="0x00ff00ff" online_cpuset="0x00ff00ff" allowed_cpuset="0x00ff00ff" nodeset="0x00010005" complete_nodeset="0x00010005" allowed_nodeset="0x00010005">
    <info name="Backend" value="Linux"/>
    <info name="Architecture" value="ia64"/>
    <info name="hwlocVersion" value="1.11.8"/>
    <info name="ProcessName" value="lstopo"/>
    <distances nbobjs="3" relative_depth="1" latency_base="10.000000">
      <latency value="1.000000"/>
      <latency value="1.700000"/>
      <latency value="1.700000"/>
      <latency value="1.700000"/>
      <latency value="1.700000"/>
      <latency value="1.000000"/>
      <latency value="1.400000"/>
      <latency value="1.400000"/>
      <latency value="1.400000"/>
    </distances>
    <object type="NUMANode" os_index="0" cpuset="0x0000000f" complete_cpuset="0x0000000f" online_cpuset="0x0000000f" allowed_cpuset="0x0000000f" nodeset="0x00000001" complete_nodeset="0x00000001" allowed_nodeset="0x00000001" local_memory="102458458112">
      <object type="Package" os_index="0" cpuset="0x00000003" complete_cpuset="0x00000003" online_cpuset="0x00000003" allowed_cpuset="0x00000003" nodeset="0x00000001" complete_nodeset="0x00000001" allowed_nodeset="0x00000001">
        <info name="CPUVendor" value="GenuineIntel"/>
        <info name="CPUFamilyNumber" value="32"/>
        <info name="CPUModelNumber" value="1"/>
        <info name="CPUModel" value="Dual-Core Intel(R) Itanium(R) Processor 9140N"/>
        <object type="Core" os_index="0" cpuset="0x00000001" complete_cpuset="0x00000001" online_cpuset="0x00000001" allowed_cpuset="0x00000001" nodeset="0x00000001" complete_nodeset="0x00000001" allowed_nodeset="0x00000001">
          <object type="PU" os_index="0" cpuset="0x00000001" complete_cpuset="0x00000001" online_cpuset="0x00000001" allowed_cpuset="0x00000001" nodeset="0x00000001" complete_nodeset="0x00000001" allowed_nodeset="0x00000001"/>
        </object>
        <object type="Core" os_index="1" cpuset="0x00000002" complete_cpuset="0x00000002" online_cpuset="0x00000002" allowed_cpuset="0x00000002" nodeset="0x00000001" complete_nodeset="0x00000001" allowed_nodeset="0x00000001">
          <object type="PU" os_index="1" cpuset="0x00000002" complete_cpuset="0x00000002" online_cpuset="0x00000002" allowed_cpuset="0x00000002" nodeset="0x00000001" complete_nodeset="0x00000001" allowed_nodeset="0x00000001"/>
        </object>
      </object>
      <object type="Package" os_index="1" cpuset="0x0000000c" complete_cpuset="0x0000000c" online_cpuset="0x0000000c" allowed_cpuset="0x0000000c" nodeset="0x00000001" complete_nodeset="0x00000001" allowed_nodeset="0x00000001">
        <info name="CPUVendor" value="GenuineIntel"/>
        <info name="CPUFamilyNumber" value="32"/>
        <info name="CPUModelNumber" value="1"/>
        <info name="CPUModel" value="Dual-Core Intel(R) Itanium(R) Processor 9140N"/>
        <object type="Core" os_index="0" cpuset="0x00000004" complete_cpuset="0x00000004" online_cpuset="0x00000004" allowed_cpuset="0x00000004" nodeset="0x00000001" complete_nodeset="0x00000001" allowed_nodeset="0x00000001">
          <object type="PU" os_index="2" cpuset="0x00000004" complete_cpuset="0x00000004" online_cpuset="0x00000004" allowed_cpuset="0x00000004" nodeset="0x00000001" complete_nodeset="0x00000001" allowed_nodeset="0x00000001"/>
        </object>
        <object type="Core" os_index="1" cpuset="0x00000008" complete_cpuset="0x00000008" online_cpuset="0x00000008" allowed_cpuset="0x00000008" nodeset="0x00000001" complete_nodeset="0x00000001" allowed_nodeset="0x00000001">
          <object type="PU" os_index="3" cpuset="0x00000008" complete_cpuset="0x00000008" online_cpuset="0x00000008" allowed_cpuset="0x00000008" nodeset="0x00000001" complete_nodeset="0x00000001" allowed_nodeset="0x00000001"/>
        </object>
      </object>
    </object>
    <object type="NUMANode" os_index="2" cpuset="0x000f0000" complete_cpuset="0x000f0000" online_cpuset="0x000f0000" allowed_cpuset="0x000f0000" nodeset="0x00000004" complete_nodeset="0x00000004" allowed_nodeset="0x00000004" local_memory="103012106240">
      <object type="Package" os_index="131072" cpuset="0x00030000" complete_cpuset="0x00030000" online_cpuset="0x00030000" allowed_cpuset="0x00030000" nodeset="0x00000004" complete_nodeset="0x00000004" allowed_nodeset="0x00000004">
        <info name="CPUVendor" value="GenuineIntel"/>
        <info name="CPUFamilyNumber" value="32"/>
        <info name="CPUModelNumber" value="1"/>
        <info name="CPUModel" value="Dual-Core Intel(R) Itanium(R) Processor 9140N"/>
        <object type="Core" os_index="0" cpuset="0x00010000" complete_cpuset="0x00010000" online_cpuset="0x00010000" allowed_cpuset="0x00010000" nodeset="0x00000004" complete_nodeset="0x00000004" allowed_nodeset="0x00000004">
          <object type="PU" os_index="16" cpuset="0x00010000" complete_cpuset="0x00010000" online_cpuset="0x00010000" allowed_cpuset="0x00010000" nodeset="0x00000004" complete_nodeset="0x00000004" allowed_nodeset="0x00000004"/>
        </object>
        <object type="Core" os_index="1" cpuset="0x00020000" complete_cpuset="0x00020000" online_cpuset="0x00020000" allowed_cpuset="0x00020000" nodeset="0x00000004" complete_nodeset="0x00000004" allowed_nodeset="0x00000004">
          <object type="PU" os_index="17" cpuset="0x00020000" complete_cpuset="0x00020000" online_cpuset="0x00020000" allowed_cpuset="0x00020000" nodeset="0x00000004" complete_nodeset="0x00000004" allowed_nodeset="0x00000004"/>
        </object>
      </object>
      <object type="Package" os_index="131073" cpuset="0x000c0000" complete_cpuset="0x000c0000" online_cpuset="0x000c0000" allowed_cpuset="0x000c0000" nodeset="0x00000004" complete_nodeset="0x00000004" allowed_nodeset="0x00000004">
        <info name="CPUVendor" value="GenuineIntel"/>
        <info name="CPUFamilyNumber" value="32"/>
        <info name="CPUModelNumber" value="1"/>
        <info name="CPUModel" value="Dual-Core Intel(R) Itanium(R) Processor 9140N"/>
        <object type="Core" os_index="0" cpuset="0x00040000" complete_cpuset="0x00040000" online_cpuset="0x00040000" allowed_cpuset="0x00040000" nodeset="0x00000004" complete_nodeset="0x00000004" allowed_nodeset="0x00000004">
          <object type="PU" os_index="18" cpuset="0x00040000" complete_cpuset="0x00040000" online_cpuset="0x00040000" allowed_cpuset="0x00040000" nodeset="0x00000004" complete_nodeset="0x00000004" allowed_nodeset="0x00000004"/>
        </object>
        <object type="Core" os_index="1" cpuset="0x00080000" complete_cpuset="0x00080000" online_cpuset="0x00080000" allowed_cpuset="0x00080000" nodeset="0x00000004" complete_nodeset="0x00000004" allowed_nodeset="0x00000004">
          <object type="PU" os_index="19" cpuset="0x00080000" complete_cpuset="0x00080000" online_cpuset="0x00080000" allowed_cpuset="0x00080000" nodeset="0x00000004" complete_nodeset="0x00000004" allowed_nodeset="0x00000004"/>
        </object>
      </object>
    </object>
    <object type="NUMANode" os_index="16" cpuset="0x0" complete_cpuset="0x0" online_cpuset="0x0" allowed_cpuset="0x0" nodeset="0x00010000" complete_nodeset="0x00010000" allowed_nodeset="0x00010000" local_memory="1044660224"/>
  </object>
</topology>
